band,name,title,video_id,comment,dislike,like,view
TPE48,Shih-Ya Chen,TPE48  陳 詩雅 (SHIH-YA CHEN / チェン シーヤー),ZZ6kBIs6DSU,,,,16998
TPE48,Shih-Yuan Chen,TPE48  陳 詩媛 (SHIH-YUAN CHEN / チェン シーユエン),JPNvnqGCVo4,,,,8780
TPE48,Yuzuka Honda,TPE48  本田 柚萱 (YUZUKA HONDA / ホンダ ユズカ),OsUbHP0VbPU,,,,10820
TPE48,Pin-Han Chiu,TPE48  邱 品涵 (PIN-HAN CHIU / チウ ピンハン),CAe8LofQSt4,,,,7730
TPE48,Tik Kei Sin,TPE48  冼 迪琦 (TIK KEI SIN / シェー ディーチー),RLcU1X4BV6c,,,,14086
BNK48,Cherprang Areekul,BNK48 キャプテン [Captain]  CHERPRANG (CHERPRANG AREEKUL / チャープラン),Uk-uRg4JNfQ,,,,277806
BNK48,Rina Izuta,BNK48 Team BIII  IZURINA (伊豆田 莉奈 / イズリナ),jkTaeNGmFLM,,,,120185
BNK48,Napaphat Worraphuttanon,BNK48 Team BIII  JAA (NAPAPHAT WORRAPHUTTANON / ジャー),1IlNlUV1eMo,,,,38412
BNK48,Jennis Oprasert,BNK48 Team BIII 副キャプテン [Vice Captain]  JENNIS (JENNIS OPRASERT / ジェニス),Ps8iWW68ys4,,,,155393
BNK48,Warattaya Deesomlert,BNK48 Team BIII  KAIMOOK (WARATTAYA DEESOMLERT / カイムック),mELcHJ4BFpY,,,,108094
BNK48,Korapat Nilprapa,BNK48 Team BIII  KATE (KORAPAT NILPRAPA / ケート),XLWAiENfkoc,,,,53078
BNK48,Miori Ohkubo,BNK48 Team BIII  MIORI (大久保 美織 / ミオリ),Hf4o9u-Aby4,,,,99078
BNK48,Praewa Suthamphong,BNK48 Team BIII  MUSIC (PRAEWA SUTHAMPHONG / ミュージック),OTWBg_wO4G0,,,,208993
BNK48,Sawitchaya Kajonrungsilp,BNK48 Team BIII  SATCHAN (SAWITCHAYA KAJONRUNGSILP / サッチャン),jaYn1M4ZvK8,,,,123384
BNK48,Mananya Kaoju,BNK48 研究生 [Trainee]  NINK (MANANYA KAOJU / ニンク),QLgGqYuaQ-0,,,,49638
STU48,Chiho Ishida,STU48 石田 千穂 (CHIHO ISHIDA),CDUqC-FkBtA,,,,11680
STU48,Minami Ishida,STU48 石田 みなみ (MINAMI ISHIDA),zUqjT4iU3_A,,,,3778
STU48,Kanon Isogai,STU48 磯貝 花音 (KANON ISOGAI),dXa80CXqn48,,,,2617
STU48,Ayumi Ichioka,STU48 市岡 愛弓 (AYUMI ICHIOKA),5gSmV_8UTQ0,,,,5190
STU48,Mitsuki Imamura,STU48 今村 美月 (MITSUKI IMAMURA),IURoYpdyszQ,,,,2938
STU48,Hina Iwata,STU48 岩田 陽菜 (HINA IWATA),Rqtgmcs3wHs,,,,7486
STU48,Marina Otani,STU48 大谷 満理奈 (MARINA OTANI),y1DwKSQWxQ0,,,,3271
STU48,Kokoa Kai,STU48 甲斐 心愛 (KOKOA KAI),GkiKq7Qpk0A,,,,3866
STU48,Momona Kadota,STU48 門田 桃奈 (MOMONA KADOTA),ADAptf0knMw,,,,1821
STU48,Miyuna Kadowaki,STU48 門脇 実優菜 (MIYUNA KADOWAKI),8TMQcNaFSqw,,,,2494
STU48,Miyu Sakaki,STU48 榊 美優 (MIYU SAKAKI),jgOmCT5vL-M,,,,3103
STU48,Haruka Sano,STU48 佐野 遥 (HARUKA SANO),Mkc3TmuW05Q,,,,1835
STU48,Hinako Shioi,STU48 塩井 日奈子 (HINAKO SHIOI),F45YIcRlCf8,,,,1580
STU48,Nonoka Shintani,STU48 新谷 野々花 (NONOKA SHINTANI),YZYmdH83V5E,,,,2246
STU48,Saki Sugahara,STU48 菅原 早記 (SAKI SUGAHARA),GG0g3vCnz9Q,,,,1467
STU48,Yumiko Takino,STU48 瀧野 由美子 (YUMIKO TAKINO),49tGyElQkdI,,,,22474
STU48,Kouko Tanaka,STU48 田中 皓子 (KOUKO TANAKA),L-APjQGkTpM,,,,3238
STU48,Mahina Taniguchi,STU48 谷口 茉妃菜 (MAHINA TANIGUCHI),o4s9QX0_E6A,,,,1321
STU48,Yuri Torobu,STU48 土路生 優里 (YURI TOROBU),Uan1_voWnl8,,,,3965
STU48,Aoi Hyodo,STU48 兵頭 葵 (AOI HYODO),cSaLlUg1D5o,,,,1552
STU48,Akari Fukuda,STU48 福田 朱里 (AKARI FUKUDA),Q3mekuyeHoM,,,,3137
STU48,Azusa Fujiwara,STU48 藤原 あずさ (AZUSA FUJIWARA),Mi9OuLzP2dM,,,,1791
STU48,Haruka Mishima,STU48 三島 遥香 (HARUKA MISHIMA),5oEPaqqWzdk,,,,1229
STU48,Arisa Mineyoshi,STU48 峯吉 愛梨沙 (ARISA MINEYOSHI),fRZbnyLDXmw,,,,2779
STU48,Kaho Mori,STU48 森 香穂 (KAHO MORI),EZNPoxuQiMA,,,,1499
STU48,Maiha Morishita,STU48 森下 舞羽 (MAIHA MORISHITA),-Xez4_UaEIo,,,,1667
STU48,Honoka Yano,STU48 矢野 帆夏 (HONOKA YANO),QfQaS1J-ss4,,,,2000
STU48,Fu Yabushita,STU48 薮下 楓 (FU YABUSHITA),Bs_7QV5mTpc,,,,8632
STU48,Yuka Oki,STU48 ドラフト研究生 [Draft trainee]  沖 侑果 (YUKA OKI),VsrnkS5JRns,,,,2922
STU48,Soraha Shinano,STU48 ドラフト研究生 [Draft trainee]  信濃 宙花 (SORAHA SHINANO),vi5EAlY5xbM,,,,2064
STU48,Mai Nakamura,STU48 ドラフト研究生 [Draft trainee]  中村 舞 (MAI NAKAMURA),ecVAMbxMdSc,,,,3538
STU48,Aiko Mizoguchi,STU48 ドラフト研究生 [Draft trainee]  溝口 亜以子 (AIKO MIZOGUCHI),y28OPwGXGBs,,,,2057
STU48,Akari Yura,STU48 ドラフト研究生 [Draft trainee]  由良 朱合 (AKARI YURA),9_6qcrg5Gjs,,,,2108
NGT48,Yuka Ogino,NGT48Team NIII 副キャプテン [Vice Captain]  荻野 由佳 (YUKA OGINO),MTRFZBVGgqk,,,,65594
NGT48,Tsugumi Oguma,NGT48 Team NIII  小熊 倫実 (TSUGUMI OGUMA),FReUJJzzCA8,,,,14031
NGT48,Minami Kato,NGT48 Team NIII  加藤 美南 (MINAMI KATO),Sz2k-_DFDwE,,,,41489
NGT48,Anju Sato,NGT48 Team NIII  佐藤 杏樹 (ANJU SATO),eRy9ZgmSPO4,,,,7503
NGT48,Riko Sugahara,NGT48 Team NIII  菅原 りこ (RIKO SUGAHARA),RTvWhiWsOtM,,,,8413
NGT48,Moeka Takakura,NGT48 Team NIII  高倉 萌香 (MOEKA TAKAKURA),LUc8InWywt8,,,,15084
NGT48,Ayaka Tano,NGT48 Team NIII  太野 彩香 (AYAKA TANO),QsWk6cObgoU,,,,6679
NGT48,Rika Nakai,NGT48 Team NIII  中井 りか (RIKA NAKAI),urP08SlVVxg,,,,91679
NGT48,Marina Nishigata,NGT48 Team NIII  西潟 茉莉奈 (MARINA NISHIGATA),5fS-G3Wxb4w,,,,12025
NGT48,Rena Hasegawa,NGT48 Team NIII  長谷川 玲奈 (RENA HASEGAWA),GC-0Y1IJERA,,,,6298
NGT48,Hinata Homma,NGT48 Team NIII  本間 日陽 (HINATA HOMMA),o36cAEuu0f0,,,,29243
NGT48,Fuka Murakumo,NGT48 Team NIII  村雲 颯香 (FUKA MURAKUMO),Mxp7Y8UjSo4,,,,6633
NGT48,Maho Yamaguchi,NGT48 Team NIII  山口 真帆 (MAHO YAMAGUCHI),zpjM19lv4-Q,,,,8780
NGT48,Noe Yamada,NGT48 Team NIII  山田 野絵 (NOE YAMADA),uqJLNG6uZo4,,,,7184
NGT48,Chikana Ando,NGT48 Team NIII ドラフト研究生 [Draft trainee]  安藤 千伽奈 (CHIKANA ANDO),4CEhnrl-V4w,,,,4914
NGT48,Kairi Sato,NGT48 Team NIII ドラフト研究生 [Draft trainee]  佐藤 海里 (KAIRI SATO),tOW9XQePPUo,,,,4415
NGT48,Nanami Takahashi,NGT48 Team NIII ドラフト研究生 [Draft trainee]  高橋 七実 (NANAMI TAKAHASHI),CtGHG7jnTX0,,,,4980
NGT48,Yunako Tsushima,NGT48 Team NIII ドラフト研究生 [Draft trainee]  對馬 優菜子 (YUNAKO TSUSHIMA),TxV64lSxwwg,,,,6020
NGT48,Miyu Fujisaki,NGT48 Team NIII ドラフト研究生 [Draft trainee]  藤崎 未夢 (MIYU FUJISAKI),H9tTeVZrQ-g,,,,3861
NGT48,Yuria Kado,NGT48 研究生 [Trainee]  角 ゆりあ (YURIA KADO),f91k8AgiECM,,,,6378
NGT48,Aina Kusakabe,NGT48 研究生 [Trainee]  日下部 愛菜 (AINA KUSAKABE),rHOxw8qJfyo,,,,4427
NGT48,Reina Seiji,NGT48 研究生 [Trainee]  清司 麗菜 (REINA SEIJI),ISGRKVZhLZg,,,,27342
NGT48,Mau Takahashi,NGT48 研究生 [Trainee]  髙橋 真生 (MAU TAKAHASHI),I3Re75LLf90,,,,4983
NGT48,Ayuka Nakamura,NGT48 研究生 [Trainee]  中村 歩加 (AYUKA NAKAMURA),mAgDcu3SRUk,,,,7319
NGT48,Miharu Nara,NGT48 研究生 [Trainee]  奈良 未遥 (MIHARU NARA),YAGMXxDaNQg,,,,8353
NGT48,Nanako Nishimura,NGT48 研究生 [Trainee]  西村 菜那子 (NANAKO NISHIMURA),DmNu8pcrmBM,,,,4038
HKT48,Yuka Akiyoshi,HKT48 Team H  秋吉 優花 (YUKA AKIYOSHI),4norMUoxkH8,,,,9237
HKT48,Haruka Ueno,HKT48 Team H  上野 遥 (HARUKA UENO),p4YjLlEFQoA,,,,3153
HKT48,Yui Kojina,HKT48 Team H  神志那 結衣 (YUI KOJINA),7Hmo9ks6czs,,,,6727
HKT48,Hiroka Komada,HKT48 Team H  駒田 京伽 (HIROKA KOMADA),sGRgS3dDW5A,,,,4144
HKT48,Riko Sakaguchi,HKT48 Team H  坂口 理子 (RIKO SAKAGUCHI),Jiuux3ycUn4,,,,6580
HKT48,Meru Tashima,HKT48 Team H  田島 芽瑠 (MERU TASHIMA),6zLCZwTP43M,,,,12497
HKT48,Natsumi Tanaka,HKT48 Team H  田中 菜津美 (NATSUMI TANAKA),fo2e8qi7pmo,,,,6845
HKT48,Miku Tanaka,HKT48 Team H  田中 美久 (MIKU TANAKA),b9OTi6nWQAY,,,,38342
HKT48,Aki Toyonaga,HKT48 Team H  豊永 阿紀 (AKI TOYONAGA),6RiqV1Fqquo,,,,16375
HKT48,Natsumi Matsuoka,HKT48 Team H キャプテン [Captain]  松岡 菜摘 (NATSUMI MATSUOKA),YVdN3Cs2Ljo,,,,10264
HKT48,Nako Yabuki,HKT48 Team H  矢吹 奈子 (NAKO YABUKI),qTlZoJifsSE,,,,67701
HKT48,Yueru Ito,HKT48 Team H ドラフト研究生 [Draft trainee]  伊藤 優絵瑠 (YUERU ITO),6vVBO5K36JQ,,,,2615
HKT48,Akari Watanabe,HKT48 Team H ドラフト研究生 [Draft trainee]  渡部 愛加里 (AKARI WATANABE),xcvAigInY60,,,,5349
HKT48,Shino Iwahana,HKT48 Team KIV  岩花 詩乃 (SHINO IWAHANA),Fre_hKRm6hg,,,,2649
HKT48,Nao Ueki,HKT48 Team KIV  植木 南央 (NAO UEKI),43dvJXDB05A,,,,4666
HKT48,Hirona Unjo,HKT48 Team KIV  運上 弘菜 (HIRONA UNJO),L2-W_Z2btgg,,,,7634
HKT48,Serina Kumazawa,HKT48 Team KIV  熊沢 世莉奈 (SERINA KUMAZAWA),FwG4KcaSFzQ,,,,2635
HKT48,Yuki Shimono,HKT48 Team KIV  下野 由貴 (YUKI SHIMONO),6O02T5gZu4s,,,,2275
HKT48,Nene Jitoe,HKT48 Team KIV  地頭江 音々 (NENE JITOE),f_loujMEJwQ,,,,5144
HKT48,Mio Tomonaga,HKT48 Team KIV  朝長 美桜 (MIO TOMONAGA),SUoKcDtbPA8,,,,17946
HKT48,Maiko Fukagawa,HKT48 Team KIV  深川 舞子 (MAIKO FUKAGAWA),gmQ_trhkLiE,,,,2306
HKT48,Mai Fuchigami,HKT48 Team KIV  渕上 舞 (MAI FUCHIGAMI),p79OFgomogU,,,,5159
HKT48,Sakura Miyawaki,HKT48 Team KIV 副キャプテン [Vice Captain]  宮脇 咲良 (SAKURA MIYAWAKI),iluTBJLwv1E,,,,190235
HKT48,Aoi Motomura,HKT48 Team KIV キャプテン [Captain]  本村 碧唯 (AOI MOTOMURA),Y8bJG2tWkpU,,,,11262
HKT48,Sayaka Baba,HKT48 Team KIV ドラフト研究生 [Draft trainee]  馬場 彩華 (SAYAKA BABA),YIbiUJioMwk,,,,3545
HKT48,Misaki Aramaki,HKT48 Team TII  荒巻 美咲 (MISAKI ARAMAKI),8ZAmkGc1_SU,,,,4590
HKT48,Maria Imamura,HKT48 Team TII  今村 麻莉愛 (MARIA IMAMURA),EZRAIx8mvUU,,,,21145
HKT48,Ayaka Oda,HKT48 Team TII  小田 彩加 (AYAKA ODA),RAiGvpelobk,,,,4198
HKT48,Sae Kurihara,HKT48 Team TII  栗原 紗英 (SAE KURIHARA),KWJC9j37Cfs,,,,3550
HKT48,Moeka Sakai,HKT48 Team TII  堺 萌香 (MOEKA SAKAI),F65qFprLNK4,,,,3765
HKT48,Erena Sakamoto,HKT48 Team TII  坂本 愛玲菜 (ERENA SAKAMOTO),qtFwMOcC8PQ,,,,2582
HKT48,Rio Shimizu,HKT48 Team TII  清水 梨央 (RIO SHIMIZU),Vqg9V-iIBSk,,,,2591
HKT48,Tomoka Takeda,HKT48 Team TII  武田 智加 (TOMOKA TAKEDA),Q8hfOIqwu8g,,,,4880
HKT48,Amane Tsukiashi,HKT48 Team TII  月足 天音 (AMANE TSUKIASHI),dj6ji44gTx8,,,,3787
HKT48,Hazuki Hokazono,HKT48 Team TII 副キャプテン [Vice Captain]  外薗 葉月 (HAZUKI HOKAZONO),XgOT2PaQgno,,,,3217
HKT48,Hana Matsuoka,HKT48 Team TII  松岡 はな (HANA MATSUOKA),nNDz6TDPS10,,,,29465
HKT48,Hinata Matsumoto,HKT48 Team TII  松本 日向 (HINATA MATSUMOTO),V00lbOJyCMc,,,,3883
HKT48,Sono Miyazaki,HKT48 Team TII  宮﨑 想乃 (SONO MIYAZAKI),Rpv7O1uqMQ0,,,,2611
HKT48,Bibian Murakawa,HKT48 Team TII  村川 緋杏 (BIBIAN MURAKAWA),XXCDzJ-4Lo4,,,,10816
HKT48,Yuna Yamauchi,HKT48 Team TII  山内 祐奈 (YUNA YAMAUCHI),uOs4SzgVies,,,,2286
HKT48,Ai Seki,HKT48 Team TII ドラフト研究生 [Draft trainee]  石 安伊 (AI SEKI),NC1wY0cWjz0,,,,3072
HKT48,Yumi Matsuda,HKT48 Team TII ドラフト研究生 [Draft trainee]  松田 祐実 (YUMI MATSUDA),qBkE-MkphT4,,,,2991
NMB48,Yuki Azuma,NMB48 Team N  東 由樹 (YUKI AZUMA),KpVen2LZ5TM,,,,8644
NMB48,Cocona Umeyama,NMB48 Team N  梅山 恋和 (COCONA UMEYAMA),GafutB7SLVM,,,,16578
NMB48,Karin Kojima,NMB48 Team N  小嶋 花梨 (KARIN KOJIMA),h0fNhMLCVbU,,,,7072
NMB48,Airi Tanigawa,NMB48 Team N  谷川 愛梨 (AIRI TANIGAWA),KqaJW4pYVqs,,,,7947
NMB48,Kokoro Naiki,NMB48 Team N  内木 志 (KOKORO NAIKI),fix2YIjFsbI,,,,4099
NMB48,Shion Hori,NMB48 Team N  堀 詩音 (SHION HORI),LxP8ngQF5EA,,,,3756
NMB48,Yuzuha Hongo,NMB48 Team N  本郷 柚巴 (YUZUHA HONGO),azlSJvrvtqc,,,,6968
NMB48,Rina Yamao,NMB48 Team N 副キャプテン [Vice Captain]  山尾 梨奈 (RINA YAMAO),m2-F8mYmVz8,,,,4333
NMB48,Ayaka Yamamoto,NMB48 Team N  山本 彩加 (AYAKA YAMAMOTO),2us-zGQuxy0,,,,21444
NMB48,Wakana Abe,NMB48 Team N ドラフト研究生 [Draft trainee]  安部 若菜 (WAKANA ABE),TNsa61YOItM,,,,4464
NMB48,Ayano Izumi,NMB48 Team N ドラフト研究生 [Draft trainee]  泉 綾乃 (AYANO IZUMI),w3pzdppz0wU,,,,3240
NMB48,Nanaho Kawano,NMB48 Team N ドラフト研究生 [Draft trainee]  河野 奈々帆 (NANAHO KAWANO),hqCDq-Rf0_Q,,,,2273
NMB48,Reiko Maeda,NMB48 Team N ドラフト研究生 [Draft trainee]  前田 令子 (REIKO MAEDA),42WjkzFwDxM,,,,3119
NMB48,Maria Mizobuchi,NMB48 Team N ドラフト研究生 [Draft trainee]  溝渕 麻莉亜 (MARIA MIZOBUCHI),oCOLnv79t0A,,,,2911
NMB48,Kanae Iso,NMB48 Team M 副キャプテン [Vice Captain]  磯 佳奈江 (KANAE ISO),5XehrtCjOIQ,,,,4158
NMB48,Momoka Iwata,NMB48 Team M  岩田 桃夏 (MOMOKA IWATA),NL28oXyBWeA,,,,4741
NMB48,Yuuka Kato,NMB48 Team M  加藤 夕夏 (YUUKA KATO),wIlf78nk600,,,,8220
NMB48,Chihiro Kawakami,NMB48 Team M  川上 千尋 (CHIHIRO KAWAKAMI),flqHG3kZgFM,,,,6402
NMB48,Rena Kawakami,NMB48 Team M キャプテン [Captain]  川上 礼奈 (RENA KAWAKAMI),fuLeeKmgzm0,,,,3885
NMB48,Nagisa Shibuya,NMB48 Team M  渋谷 凪咲 (NAGISA SHIBUYA),OLcA-U0rw6Y,,,,17246
NMB48,Miru Shiroma,NMB48 Team M  白間 美瑠 (MIRU SHIROMA),kbioD2f7Owg,,,,42438
NMB48,Rurina Nishizawa,NMB48 Team M  西澤 瑠莉奈 (RURINA NISHIZAWA),o7dmkU4i8jA,,,,2931
NMB48,Momone Yasuda,NMB48 Team M  安田 桃寧 (MOMONE YASUDA),fV6II3NkWjc,,,,5036
NMB48,Suzu Yamada,NMB48 Team M  山田 寿々 (SUZU YAMADA),dDFtNnDI_lw,,,,5446
NMB48,Akari Yoshida,NMB48 Team M  吉田 朱里 (AKARI YOSHIDA),JX6nhtKFTuU,,,,98424
NMB48,Ai Osawa,NMB48 Team M ドラフト研究生 [Draft trainee]  大澤 藍 (AI OSAWA),oqMdYXfgKG0,,,,2312
NMB48,Nami Sakamoto,NMB48 Team M ドラフト研究生 [Draft trainee]  坂本 夏海 (NAMI SAKAMOTO),sNNYjxrKTMU,,,,2345
NMB48,Ami Sato,NMB48 Team M ドラフト研究生 [Draft trainee]  佐藤 亜海 (AMI SATO),re8-YbDJsLY,,,,3475
NMB48,Kotone Sugiura,NMB48 Team M ドラフト研究生 [Draft trainee]  杉浦 琴音 (KOTONE SUGIURA),bvR9gWcO-j0,,,,2265
NMB48,Mirai Nakano,NMB48 Team M ドラフト研究生 [Draft trainee]  中野 美来 (MIRAI NAKANO),C6GvYGD5YuA,,,,2774
NMB48,Amiru Yamasaki,NMB48 Team M ドラフト研究生 [Draft trainee]  山崎 亜美瑠 (AMIRU YAMASAKI),Mn165Wolau0,,,,3049
NMB48,Akari Ishizuka,NMB48 Team BII  石塚 朱莉 (AKARI ISHIZUKA),XzI_gEskhm4,,,,7041
NMB48,Anna Ijiri,NMB48 Team BII  井尻 晏菜 (ANNA IJIRI),_ECgV7Ro59c,,,,3481
NMB48,Azusa Uemura,NMB48 Team BII  植村 梓 (AZUSA UEMURA),Lnlx-Wzvca8,,,,14525
NMB48,Yuuri Ota,NMB48 Team BII  太田 夢莉 (YUURI OTA),WvdNSRndmZQ,,,,29726
NMB48,Rina Kushiro,NMB48 Team BII キャプテン [Captain]  久代 梨奈 (RINA KUSHIRO),VVt_tlNLdj8,,,,4228
NMB48,Rika Shimizu,NMB48 Team BII  清水 里香 (RIKA SHIMIZU),gooN6xPdokU,,,,4007
NMB48,Eriko Jo,NMB48 Team BII  城 恵理子 (ERIKO JO),QpHdZoiF0ak,,,,4436
NMB48,Rei Jonishi,NMB48 Team BII  上西 怜 (REI JONISHI),4quQs6QCcak,,,,14662
NMB48,Sara Takei,NMB48 Team BII  武井 紗良 (SARA TAKEI),lRtdE96HH2U,,,,2751
NMB48,Mion Nakagawa,NMB48 Team BII  中川 美音 (MION NAKAGAWA),5yhgOQCYM5I,,,,3670
NMB48,Shiori Mizuta,NMB48 Team BII  水田 詩織 (SHIORI MIZUTA),o42e8Qnej8k,,,,2399
NMB48,Sae Murase,NMB48 Team BII  村瀬 紗英 (SAE MURASE),uJJd1G3y0mI,,,,10181
NMB48,Ayaka Morita,NMB48 Team BII  森田 彩花 (AYAKA MORITA),MhHThmirm_Y,,,,2155
NMB48,Riona Ota,NMB48 Team BII ドラフト研究生 [Draft trainee]  大田 莉央奈 (RIONA OTA),yx1jsP2MMec,,,,4480
NMB48,Keito Shiotsuki,NMB48 Team BII ドラフト研究生 [Draft trainee]  塩月 希依音 (KEITO SHIOTSUKI),0N0-cRFlNNM,,,,4118
NMB48,Haasa Minami,NMB48 Team BII ドラフト研究生 [Draft trainee]  南 羽諒 (HAASA MINAMI),bjfpmzD9xhE,,,,2194
NMB48,Mikana Yamamoto,NMB48 Team BII ドラフト研究生 [Draft trainee]  山本 望叶 (MIKANA YAMAMOTO),L8wBykUUBBU,,,,5791
SKE48,Rena Isshiki,SKE48 Team S  一色 嶺奈 (RENA ISSHIKI),h4DcBBFN7Tg,,,,10401
SKE48,Ruka Inoue,SKE48 Team S  井上 瑠夏 (RUKA INOUE),vGviElwYWDE,,,,6142
SKE48,Ayuka Kamimura,SKE48 Team S  上村 亜柚香 (AYUKA KAMIMURA),5x5dujDmKGQ,,,,3963
SKE48,Yoshino Kitagawa,SKE48 Team S  北川 愛乃 (YOSHINO KITAGAWA),nvE0x7Q43to,,,,3524
SKE48,Ryoha Kitagawa,SKE48 Team S リーダー [Leader]  北川 綾巴 (RYOHA KITAGAWA),MGUB22qRSBo,,,,7333
SKE48,Aika Sugiyama,SKE48 Team S  杉山 愛佳 (AIKA SUGIYAMA),CUjUmd8JREU,,,,2508
SKE48,Kano Nojima,SKE48 Team S  野島 樺乃 (KANO NOJIMA),ERhTtFKMnzI,,,,3083
SKE48,Miyo Nomura,SKE48 Team S  野村 実代 (MIYO NOMURA),_QdYJE85NuI,,,,4423
SKE48,Otoha Machi,SKE48 Team S  町 音葉 (OTOHA MACHI),2tSB8iLT1GQ,,,,3443
SKE48,Jurina Matsui,SKE48 Team S  松井 珠理奈 (JURINA MATSUI),RBP6OBgGtPc,,,,79141
SKE48,Chikako Matsumoto,SKE48 Team S  松本 慈子 (CHIKAKO MATSUMOTO),id3PQnXIjOY,,,,3802
SKE48,Suzuran Yamauchi,SKE48 Team S  山内 鈴蘭 (SUZURAN YAMAUCHI),uvVgSTCekSQ,,,,3580
SKE48,Juna Yamada,SKE48 Team S  山田 樹奈 (JUNA YAMADA),htOMy2Lv_Ds,,,,2863
SKE48,Yuki Otani,SKE48 Team S ドラフト研究生 [Draft trainee]  大谷 悠妃 (YUKI OTANI),yzXIr0kDk5Y,,,,3563
SKE48,Honoka Kozuma,SKE48 Team S ドラフト研究生 [Draft trainee]  上妻 ほの香 (HONOKA KOZUMA),t3jhRm_gDRQ,,,,2604
SKE48,Shiori Aoki,SKE48 Team KII  青木 詩織 (SHIORI AOKI),7dX4m5j99Ug,,,,3861
SKE48,Yuki Arai,SKE48 Team KII  荒井 優希 (YUKI ARAI),Tt801QiOt-w,,,,4124
SKE48,Mikoto Uchiyama,SKE48 Team KII 副リーダー [Vice leader]  内山 命 (MIKOTO UCHIYAMA),j4RmSZQQgVs,,,,3928
SKE48,Yuna Ego,SKE48 Team KII  江籠 裕奈 (YUNA EGO),7lG0iafphHM,,,,7578
SKE48,Ayaka Ota,SKE48 Team KII  太田 彩夏 (AYAKA OTA),iUMEpvpv6BQ,,,,3912
SKE48,Mina Oba,SKE48 Team KII リーダー [Leader]  大場 美奈 (MINA OBA),kBaWNTkYXq8,,,,13798
SKE48,Yuna Obata,SKE48 Team KII  小畑 優奈 (YUNA OBATA),rExj8GTA934,,,,17093
SKE48,Narumi Kataoka,SKE48 Team KII  片岡 成美 (NARUMI KATAOKA),M942JxB7CJw,,,,2008
SKE48,Ruka Kitano,SKE48 Team KII  北野 瑠華 (RUKA KITANO),h2yuIQnU-YU,,,,3967
SKE48,Kotono Shirai,SKE48 Team KII  白井 琴望 (KOTONO SHIRAI),A_znD3WB-Ho,,,,2626
SKE48,Sarina Soda,SKE48 Team KII  惣田 紗莉渚 (SARINA SODA),wlkNdX6N3fI,,,,10628
SKE48,Yumana Takagi,SKE48 Team KII  高木 由麻奈 (YUMANA TAKAGI),3ahmrJHZsUU,,,,5712
SKE48,Akane Takayanagi,SKE48 Team KII  高柳 明音 (AKANE TAKAYANAGI),qo294SAvaS8,,,,13226
SKE48,Saki Takeuchi,SKE48 Team KII  竹内 彩姫 (SAKI TAKEUCHI),WDhh3BsePf0,,,,3460
SKE48,Yuzuki Hidaka,SKE48 Team KII  日高 優月 (YUZUKI HIDAKA),U9_hY3COqrM,,,,4604
SKE48,Nao Furuhata,SKE48 Team KII  古畑 奈和 (NAO FURUHATA),TST_PMyShnE,,,,7710
SKE48,Kaori Matsumura,SKE48 Team KII  松村 香織 (KAORI MATSUMURA),RDvD1TPwTZo,,,,15330
SKE48,Airi Mizuno,SKE48 Team KII  水野 愛理 (AIRI MIZUNO),9hBskVTSH6U,,,,3482
SKE48,Yukina Yahagi,SKE48 Team KII  矢作 有紀奈 (YUKINA YAHAGI),iIxksU5Q8Mw,,,,10937
SKE48,Airi Nakano,SKE48 Team KII ドラフト研究生 [Draft trainee]  中野 愛理 (AIRI NAKANO),MiVNQED9YAg,,,,2427
SKE48,Honoka Aikawa,SKE48 Team E  相川 暖花 (HONOKA AIKAWA),qX8AISnNafE,,,,2072
SKE48,Yuka Asai,SKE48 Team E  浅井 裕華 (YUKA ASAI),bny_LJZfajk,,,,3590
SKE48,Reona Ida,SKE48 Team E  井田 玲音名 (REONA IDA),L-vtO8Qk29k,,,,1782
SKE48,Natsuki Kamata,SKE48 Team E  鎌田 菜月 (NATSUKI KAMATA),IlrDkaAAvIc,,,,3547
SKE48,Haruka Kumazaki,SKE48 Team E  熊崎 晴香 (HARUKA KUMAZAKI),50bP4LX_OdU,,,,7252
SKE48,Makiko Saito,SKE48 Team E キャプテン [Captain]  斉藤 真木子 (MAKIKO SAITO),B4sbwoAyp0M,,,,3288
SKE48,Kaho Sato,SKE48 Team E  佐藤 佳穂 (KAHO SATO),Tp8LJ3wRUdE,,,,4858
SKE48,Oka Suenaga,SKE48 Team E  末永 桜花 (OKA SUENAGA),oYCTJFCywcY,,,,2960
SKE48,Maya Sugawara,SKE48 Team E  菅原 茉椰 (MAYA SUGAWARA),JK0RAWSMDTo,,,,5638
SKE48,Akari Suda,SKE48 Team E リーダー [Leader]  須田 亜香里 (AKARI SUDA),wZnfBrfFw14,,,,24813
SKE48,Yuki Takahata,SKE48 Team E  髙畑 結希 (YUKI TAKAHATA),-hQnri0D8vE,,,,2543
SKE48,Marika Tani,SKE48 Team E  谷 真理佳 (MARIKA TANI),y9V0eDvOqo8,,,,10992
SKE48,Nao Fukushi,SKE48 Team E 副リーダー [Vice leader]  福士 奈央 (NAO FUKUSHI),ii7eTFkSogw,,,,5759
SKE48,Marina Nishi,SKE48 Team E ドラフト研究生 [Draft trainee]  西 満里奈 (MARINA NISHI),M7DSJcDKKdw,,,,2148
SKE48,Shiina Hirata,SKE48 Team E ドラフト研究生 [Draft trainee]  平田 詩奈 (SHIINA HIRATA),19LcQcNtQE8,,,,2151
SKE48,Ayaha Atsumi,SKE48 研究生 [Trainee]  渥美 彩羽 (AYAHA ATSUMI),vXHAay4O1Gk,,,,2298
SKE48,Saki Ishikawa,SKE48 研究生 [Trainee]  石川 咲姫 (SAKI ISHIKAWA),UCklizkLHYU,,,,2633
SKE48,Yuzuki Ishiguro,SKE48 研究生 [Trainee]  石黒 友月 (YUZUKI ISHIGURO),tbv0j3jGY7M,,,,1887
SKE48,Rinka Oshiba,SKE48 研究生 [Trainee]  大芝 りんか (RINKA OSHIBA),NHw_KJn1Ts4,,,,1865
SKE48,Miku Okada,SKE48 研究生 [Trainee]  岡田 美紅 (MIKU OKADA),6wCmwSvS3SI,,,,3369
SKE48,Ami Kurashima,SKE48 研究生 [Trainee]  倉島 杏実 (AMI KURASHIMA),Rbv1RHWO9zM,,,,2844
SKE48,Marin Sakamoto,SKE48 研究生 [Trainee]  坂本 真凛 (MARIN SAKAMOTO),YUXuNQYQD5M,,,,5526
SKE48,Kohaku Shirayuki,SKE48 研究生 [Trainee]  白雪 希明 (KOHAKU SHIRAYUKI),mjm8DgX40ZE,,,,1932
SKE48,Izumi Nakamura,SKE48 研究生 [Trainee]  仲村 和泉 (IZUMI NAKAMURA),ya0wi0azbqE,,,,3159
SKE48,Miki Nonogaki,SKE48 研究生 [Trainee]  野々垣 美希 (MIKI NONOGAKI),cd1H4x1d8Qs,,,,1839
SKE48,Negai Fukai,SKE48 研究生 [Trainee]  深井 ねがい (NEGAI FUKAI),BehpJbDqXr8,,,,2113
SKE48,Riko Morihira,SKE48 研究生 [Trainee]  森平 莉子 (RIKO MORIHIRA),77ySQW15C0g,,,,1707
SKE48,Aina Wada,SKE48 研究生 [Trainee]  和田 愛菜 (AINA WADA),rc5_xNfI0I4,,,,2063
AKB48,Rena Kato,AKB48 Team A  加藤 玲奈 (RENA KATO),bHOYDGsjfpc,,,,41416
AKB48,Moe Goto,AKB48 Team A  後藤 萌咲 (MOE GOTO),a6-S1D9qYdg,,,,9586
AKB48,Ayana Shinozaki,AKB48 Team A  篠崎 彩奈 (AYANA SHINOZAKI),hYBuBQEpRyI,,,,6514
AKB48,Kurumi Suzuki,AKB48 Team A  鈴木 くるみ (KURUMI SUZUKI),MJ3eb79DZWE,,,,3767
AKB48,Manaka Taguchi,AKB48 Team A  田口 愛佳 (MANAKA TAGUCHI),c_MHbXD4aEY,,,,4664
AKB48,Erii Chiba,AKB48 Team A  千葉 恵里 (ERII CHIBA),JymYrWP_Ya0,,,,18062
AKB48,Rei Nishikawa,AKB48 Team A  西川 怜 (REI NISHIKAWA),c22IrA_6Ank,,,,4792
AKB48,Ayaka Maeda,AKB48 Team A  前田 彩佳 (AYAKA MAEDA),myRRkeeCTkk,,,,5007
AKB48,Miho Miyazaki,AKB48 Team A  宮崎 美穂 (MIHO MIYAZAKI),iBa0e9wKcIM,,,,19385
AKB48,Mion Mukaichi,AKB48 Team A  向井地 美音 (MION MUKAICHI),SbKTsm8fNLQ,,,,54705
AKB48,Yui Yokoyama,AKB48 Team A / AKB48 グループ総監督 [AKB48 Group General Manager]  横山 由依 (YUI YOKOYAMA),-RIcYhhG1dE,,,,39884
AKB48,Minami Sato,AKB48 Team A 研究生 [Trainee]  佐藤 美波 (MINAMI SATO),EkZzmKmnbuo,,,,4404
AKB48,Nagisa Shoji,AKB48 Team A 研究生 [Trainee]  庄司 なぎさ (NAGISA SHOJI),-4jIQwO1Q50,,,,2299
AKB48,Saki Michieda,AKB48 Team A 研究生 [Trainee]  道枝 咲 (SAKI MICHIEDA),12T8DtKX1vI,,,,2620
AKB48,Suzuha Yamane,AKB48 Team A 研究生 [Trainee]  山根 涼羽 (SUZUHA YAMANE),M7LGQnF-Hv0,,,,3730
AKB48,Shiori Sato,AKB48 Team A ドラフト研究生 [Draft trainee]  佐藤 詩識 (SHIORI SATO),wlKlS6Inw0w,,,,3086
AKB48,Nazuna Furukawa,AKB48 Team A ドラフト研究生 [Draft trainee]  古川 夏凪 (NAZUNA FURUKAWA),7qUZmXlRrlE,,,,2191
AKB48,Sora Honda,AKB48 Team A ドラフト研究生 [Draft trainee]  本田 そら (SORA HONDA),cay57JEMEU8,,,,2468
AKB48,Manami Ichikawa,AKB48 Team K  市川 愛美 (MANAMI ICHIKAWA),T5awWCIU8ls,,,,4188
AKB48,Mako Kojima,AKB48 Team K  小嶋 真子 (MAKO KOJIMA),D9Evythm8KE,,,,41447
AKB48,Haruka Komiyama,AKB48 Team K キャプテン [Captain]  込山 榛香 (HARUKA KOMIYAMA),81zqU27hJh0,,,,20727
AKB48,Hinana Shimoguchi,AKB48 Team K  下口 ひなな (HINANA SHIMOGUCHI),A4RJTqpz-Zs,,,,3289
AKB48,Rena Nozawa,AKB48 Team K  野澤 玲奈 (RENA NOZAWA),jDgtf3pzjWY,,,,11527
AKB48,Nana Fujita,AKB48 Team K  藤田 奈那 (NANA FUJITA),Ilm5Cl0QAps,,,,3393
AKB48,Minami Minegishi,AKB48 Team K  峯岸 みなみ (MINAMI MINEGISHI),lzcg37mXuZ8,,,,44042
AKB48,Orin Muto,AKB48 Team K  武藤 小麟 (ORIN MUTO),upxf2eYswj0,,,,17503
AKB48,Tomu Muto,AKB48 Team K  武藤 十夢 (TOMU MUTO),AaokLxPIdXo,,,,22973
AKB48,Shinobu Mogi,AKB48 Team K  茂木 忍 (SHINOBU MOGI),4boNokOwhVU,,,,6435
AKB48,Kana Yasuda,AKB48 Team K  安田 叶 (KANA YASUDA),-68xCTeqRMU,,,,3160
AKB48,Ami Yumoto,AKB48 Team K  湯本 亜美 (AMI YUMOTO),2tbKyffq0l0,,,,1890
AKB48,Ayami Nagatomo,AKB48 Team K 研究生 [Trainee]  長友 彩海 (AYAMI NAGATOMO),hnLeyi_uNdA,,,,3371
AKB48,Rina Okada,AKB48 Team K ドラフト研究生 [Draft trainee]  岡田 梨奈 (RINA OKADA),RVS0D9o4qxc,,,,2404
AKB48,Saori Katsumata,AKB48 Team K ドラフト研究生 [Draft trainee]  勝又 彩央里 (SAORI KATSUMATA),Fq408gHgY6c,,,,2168
AKB48,Ran Kobayashi,AKB48 Team K ドラフト研究生 [Draft trainee]  小林 蘭 (RAN KOBAYASHI),M1eo_hj4JtE,,,,2152
AKB48,Yuzuki Suenaga,AKB48 Team K ドラフト研究生 [Draft trainee]  末永 祐月 (YUZUKI SUENAGA),LrugFK-T7QI,,,,1804
AKB48,Megumi Nagano,AKB48 Team K ドラフト研究生 [Draft trainee]  永野 恵 (MEGUMI NAGANO),Gi_6r27p_e4,,,,1685
AKB48,Moeka Yahagi,AKB48 Team K ドラフト研究生 [Draft trainee]  矢作 萌夏 (MOEKA YAHAGI),BLs-YZL_xYA,,,,19789
AKB48,Saho Iwatate,AKB48 Team B  岩立 沙穂 (SAHO IWATATE),hyTISnPpetk,,,,7032
AKB48,Shizuka Oya,AKB48 Team B  大家 志津香 (SHIZUKA OYA),ibOiV0fQiHc,,,,6989
AKB48,Saki Kitazawa,AKB48 Team B  北澤 早紀 (SAKI KITAZAWA),6UAty2y_n_8,,,,2706
AKB48,Satone Kubo,AKB48 Team B  久保 怜音 (SATONE KUBO),ocvQZdLA3hQ,,,,7130
AKB48,Yukari Sasaki,AKB48 Team B  佐々木 優佳里 (YUKARI SASAKI),fbVGqTsIngE,,,,7104
AKB48,Juri Takahashi,AKB48 Team B キャプテン [Captain]  高橋 朱里 (JURI TAKAHASHI),iecKUKuYTmo,,,,20890
AKB48,Kayoko Takita,AKB48 Team B  田北 香世子 (KAYOKO TAKITA),xeaBCJNU9Gc,,,,4224
AKB48,Miyu Takeuchi,AKB48 Team B  竹内 美宥 (MIYU TAKEUCHI),ZI-TY5ieYfg,,,,9954
AKB48,Megu Taniguchi,AKB48 Team B  谷口 めぐ (MEGU TANIGUCHI),FlzBOViNTVg,,,,6421
AKB48,Chiyori Nakanishi,AKB48 Team B  中西 智代梨 (CHIYORI NAKANISHI),3z7lCsThdYI,,,,6309
AKB48,Yui Hiwatashi,AKB48 Team B  樋渡 結依 (YUI HIWATASHI),0LATl3wrPZM,,,,11646
AKB48,Seina Fukuoka,AKB48 Team B  福岡 聖菜 (SEINA FUKUOKA),0E7eXyfk5wI,,,,7318
AKB48,Ayu Yamabe,AKB48 Team B  山邊 歩夢 (AYU YAMABE),TDuOpr4NCKI,,,,2633
